id,sign,title,summary,intro,introQuote,detail,thumbnail
17,Sign 17,Inclusive Streets,Designing urban streets to accommodate all abilities and mobility types,"""Accessible Streets Studio...""","The Accessible Streets Studio, launched by Michigan Central Station and Newlab in 2020, pioneers inclusive urban design methodologies.","Urban streets have historically been designed primarily for able-bodied adults, creating barriers for people with disabilities, elderly residents, parents with strollers, and others with mobility limitations. The Accessible Streets Studio represents a paradigm shift toward universal design that considers the full spectrum of human ability from the outset. Their methodology involves deep engagement with disability communities, advanced sensing and mapping technologies to identify barriers, and iterative design processes that test solutions with diverse users. The work extends beyond ADA compliance - which sets minimum standards - to envision streets that actively enable independence, dignity, and full participation for everyone. This includes considerations like crossing times adequate for slower walkers, clear wayfinding for people with cognitive differences, multisensory signals for those with vision or hearing impairments, and smooth surfaces for wheeled mobility devices. The approach challenges the assumption that accessibility is a niche concern rather than a benefit for everyone - parents, delivery workers, travelers with luggage, and temporarily injured people all benefit from accessible design. As populations age and societies increasingly value inclusion, accessible street design is becoming standard practice rather than exceptional accommodation.",inclusive_streets.jpg
18,Sign 18,Climate Refugee Infrastructure,Community-led projects building infrastructure to support climate-displaced populations,"""Mutual aid organizations are building pipelines to help the new generation of climate refugees...""","Kali Akuno acquired about 50 vacant properties in Mississippi through Cooperation Jackson, converting them to support climate migrants.","Climate change is creating unprecedented population displacement, with projections suggesting hundreds of millions of people will migrate due to sea level rise, drought, extreme weather, and resource conflicts over coming decades. While governments struggle with policy frameworks, grassroots organizations are building practical infrastructure to support climate migrants. Cooperation Jackson's work in Mississippi exemplifies this approach: acquiring vacant urban properties and converting them into affordable housing, urban farms, and cooperative enterprises specifically designed to welcome climate refugees while building community resilience. This model challenges conventional disaster response and migration management by placing agency with communities rather than centralized authorities. It also integrates climate adaptation with social justice, recognizing that displacement disproportionately affects vulnerable populations. The mutual aid approach builds on historical traditions of community self-organization while incorporating modern cooperative economics and sustainable design. As climate impacts accelerate, such models offer alternatives to militarized borders and detention facilities, instead creating welcome infrastructure that benefits both newcomers and existing residents through economic development and community building.",climate_refugee.jpg
19,Sign 19,Regenerative Networks,Organizations supporting UN Sustainable Development Goals through community-led initiatives,"""The New Seed Society...""","The New Seed Society provides support for numerous UN Sustainable Development Goals including poverty elimination, quality education, decent work, inequality reduction, and sustainable communities.","The UN Sustainable Development Goals (SDGs) provide a comprehensive framework for addressing global challenges, but implementation often stalls at the gap between international policy and local action. Organizations like the New Seed Society bridge this gap by supporting community-led initiatives that advance multiple SDG targets simultaneously through integrated approaches. Rather than treating education, poverty, sustainability, and inequality as separate problems requiring separate solutions, they recognize these issues as interconnected and support holistic interventions. This might include urban farming projects that provide food security, job training, community gathering spaces, and environmental education simultaneously. The network model enables knowledge sharing and resource coordination across communities facing similar challenges, accelerating innovation diffusion. This approach challenges top-down development paradigms that imposed universal solutions regardless of local context, instead enabling communities to design interventions appropriate to their specific situations while connecting them to global resources and movements. As cities increasingly become sites of SDG implementation - often more committed than national governments - such networks provide crucial infrastructure for translating ambitious goals into tangible local improvements.",regenerative_network.jpg
20,Sign 20,Symbiotic Urbanism,Integrating living biological systems into urban infrastructure and architecture,"""Dynamic creatures...""","Before artificial structures consume the last wilderness, a new movement explores how cities and nature can coexist and enhance each other.","Contemporary urbanism largely treats nature and built environment as oppositional - cities expand at nature's expense, while conservation requires protecting areas from development. Symbiotic urbanism challenges this dichotomy, exploring how cities can integrate living biological systems as functional infrastructure rather than mere decoration. This includes building facades that support pollinator habitats; constructed wetlands providing water treatment; urban forests managing stormwater and heat; mycelium-based materials that grow into structural components; and bio-integrated systems where microorganisms, plants, and animals perform services like waste processing, air purification, and climate control. The approach requires radically different design thinking: architects become ecosystem designers; buildings have lifecycles more like organisms than static structures; maintenance involves ecological management rather than just repairs. Projects like bio-reactive facades that change color based on air quality, or structures built from living trees trained into desired forms, demonstrate possibilities. This movement reflects growing recognition that rigid separation between nature and city is neither sustainable nor desirable - cities must function as ecosystems, and healthy ecosystems must include human activity. It also addresses urban heat islands, biodiversity loss, resource scarcity, and disconnection from nature that affects human mental health.",symbiotic_urban.jpg
21,Sign 21,Mottainai Space,Surplus space in the city,Getting the most of cities across generational lines,Cities will become places where amenity and convenlence are merged for city dwellers.,"Expansion in maintenance and management costs due to the aging of facilities and difficulties of flexible space usage under legal regulations are cited as issues for urban public facilities where existing resources are expected to be used effectively. When we consider the cities of the future, it is necessary to utilize limited space as efficiently as possible, and it is anticipated that many public facilities will be designed with a view to possible future operation parameters (demographic trends) and the usage of facilities will be on a multi-functional basis wherever possible. On the other hand, the present status on the side of the government Is that they cannot handle the situation flexibly due to organizational issues caused by vertically-segmented administrative systems in addition to legal regulations. Therefore, as a measure to respond to the need for amenity as well as convenlence and efficiency where population decline and the aging of society are accelerating, there is great expectation for the recycling of public assets using asset management know-how accumulated within the private sector through utilization of public and private partnerships (PPP).",mottainai-space.jpg
22,Sign 22,Future Literacy Exhibitions,Museums and institutions creating exhibitions that explore urban futures and technology,"""Tokyo's Mori Art Museum has an exhibition about the future and technology...""","The temporary exhibition ""Future and Art: AI, Robotics, Cities, Life - How Will Humans Live Tomorrow"" showcases over 100 projects demonstrating potential futures.","Museums traditionally preserve and interpret the past, but leading institutions are increasingly creating exhibitions and programming focused on futures - not predictions, but explorations of possibilities, implications, and choices. The Mori Art Museum's ""Future and Art"" exhibition exemplified this trend, showcasing over 100 projects exploring how artificial intelligence, robotics, urban design, and emerging technologies might reshape human life. Such exhibitions serve multiple functions: they make abstract futures tangible through immersive experiences; they democratize futures thinking by engaging public audiences; they create spaces for dialogue about technological and social change; and they challenge present assumptions by presenting alternatives. This represents a broader ""futures literacy"" movement recognizing that capacity to imagine and navigate multiple possible futures has become essential for citizenship and leadership. Museums are uniquely positioned to foster this literacy: they're trusted neutral spaces; they excel at communication and interpretation; they convene diverse publics; and they connect present and future to historical context. As technological change accelerates and societies face unprecedented challenges from climate change to AI, institutions building future literacy capacity play crucial roles in democratic deliberation about the paths we choose.",future_exhibition.jpg
23,Sign 23,Sustainable Design Industry,Major design and furniture industries pivoting toward sustainability as core focus,"""The world's largest furniture fair will focus on sustainability themes this year...""","Milan's Salone del Mobile, the world's largest furniture exhibition, announced that this year's show will focus heavily on sustainable design.","Design and manufacturing industries face mounting pressure to address environmental impacts, driven by regulation, consumer demand, and genuine recognition of crisis urgency. Major industry events like Milan's Salone del Mobile - the most influential furniture fair globally - dedicating their programming to sustainability signals a fundamental industry transformation. This goes beyond individual companies making sustainable products to reconsidering entire industry paradigms: material sourcing and lifecycle impacts; production processes and energy use; product durability and repairability versus planned obsolescence; circular economy models enabling reuse and recycling; and aesthetic values that celebrate longevity over constant novelty. The furniture industry exemplifies challenges facing design sectors broadly: deeply embedded in global supply chains with complex environmental footprints; driven by fashion dynamics encouraging frequent replacement; dominated by price competition that often externalizes environmental costs. Sustainability transitions require coordinated action across supply chains, making industry-wide events crucial for establishing new standards and sharing innovations. The shift also reflects changing consumer values, particularly among younger generations who increasingly evaluate purchases through sustainability lenses. As major industries transform, they drive upstream changes in material science, manufacturing technology, and business models with ripple effects throughout economies.",sustainable_design.jpg
24,Sign 24,Circular Fashion Networks,Urban resale platforms expanding to build circular economy infrastructure,"""Duozhuayu second-hand clothing recycling service expands to multiple cities...""","China's Duozhuayu (literally ""Catch More Fish"") announced expansion of clothing resale services to Beijing, Guangzhou, Shenzhen, and all Jiangsu-Zhejiang-Shanghai cities.","Fashion represents one of the most environmentally destructive industries, generating massive waste, water pollution, carbon emissions, and exploitative labor conditions. The rise of fast fashion accelerated these impacts while creating clothing gluts in developed economies. Circular fashion models offer alternatives by extending garment lifespans through resale, repair, and recycling. Companies like Duozhuayu build urban infrastructure making circular fashion convenient: reverse logistics collecting used clothing; sorting and quality assessment facilities; online platforms connecting sellers and buyers; and community spaces for exchanges. Their expansion across major Chinese cities signals mainstreaming of secondhand consumption, particularly among younger generations increasingly rejecting fast fashion's social and environmental costs. The model benefits cities by reducing waste sent to landfills, creating local jobs in sorting and refurbishment, and providing affordable clothing access. It also enables new forms of community building around sustainable consumption values. As circular economy principles gain traction, fashion represents a crucial test case: it's a massive industry with severe impacts, but also one where consumers directly choose whether to participate in circular versus linear models. Urban resale networks make sustainable choices convenient, demonstrating that environmental solutions often require infrastructure and system design rather than just individual virtue.",circular_fashion.jpg
25,Sign 25,Energy Infrastructure Transition,Reimagining gas stations and fossil fuel infrastructure for clean energy futures,"""When electric vehicles replace fuel vehicles, what will gas stations become?""",Design firm Surbana Jurong proposes five creative transformations for gas station spaces as electric vehicles eliminate their original function.,"The transition from internal combustion to electric vehicles will leave behind vast fossil fuel infrastructure - gas stations, refineries, pipelines - that must be decommissioned or repurposed. Gas stations are particularly interesting as they occupy thousands of valuable urban sites, typically with good transportation access but contaminated soil and obsolete buildings. Rather than abandoning these sites, design firms like Surbana Jurong envision transformative reuse: repair workshops for EVs and e-bikes; package distribution micro-hubs capitalizing on location and traffic flow; covered markets or food halls serving neighborhoods; small parks or green spaces addressing urban nature deficits; or fast-charging stations with extensive amenities for the longer dwell times EV charging requires compared to gas refueling. This infrastructural transition exemplifies broader urban adaptation challenges: cities have accumulated physical infrastructure supporting particular technologies and behaviors that must evolve as societies change. The same questions apply to parking structures in autonomous vehicle futures, or office buildings if remote work dominates. Successful cities will view obsolete infrastructure as opportunity rather than liability, creatively repurposing assets to meet emerging needs while preserving embodied energy and materials. This requires flexible zoning, creative financing, and willingness to reimagine familiar urban elements.",station_transform.jpg
26,Sign 26,Civic Mining,Rediscovery and utilization technology for urban resources,I throw away nothing as I just "renew" things,With the further promotion of recycling we feel that everything can be recycled.,"The government has started to lay out a framework to secure overseas mineral resources. Overseas mineral resources can be secured only when the mining, development and foregn diplomacy activities related to resources are promoted through cooperation between the government and the public. In terms of funding the government is utilizing ODA (official development assistance) organically, systematically and seamlessly to actively provide support for the overseas activitles of compantes. In terms of education, the government is also publically seeking primary, junior high and high schools that actively work on education projects related to resources, energy and the environment and they provide teaching materials, data and information to selected schools. This activity forms the background for advancement of environmental education and recycling technology and the promotion of development of products with high recyclability and blodegradability; however, on the other hand, it cannot be denied that extreme competition over resources will occur on a global scale. Therefore, it Is expected that improvement in the self-sufficlency ratlo of resources and energy and expansion in the range of products using a domestic circulation flow will be even greater in the future.",civic-mining.jpg
27,Sign 27,Virtual Architecture Communities,Design communities creating built environments in metaverse platforms,"""Architecture by Artists in the metaverse for The Row...""","Designers created numerous architectural works for the metaverse community The Row, pioneering virtual urban design practices.","Architecture has always existed partly in imagination - through drawings, models, and renderings that precede physical construction. The metaverse makes virtual architecture fully experiential, enabling people to inhabit designed spaces without physical construction. Communities like The Row commission architects to create virtual buildings, neighborhoods, and cities where people gather, work, and socialize. This isn't merely digital visualization of intended physical buildings, but architecture designed specifically for virtual experience, freed from physical constraints like gravity, material properties, and construction costs. Designers explore impossible geometries, spaces that reconfigure based on use, and environments that blend multiple locations or time periods. The practice challenges fundamental architectural concepts: What is architecture without physical presence? How do design principles developed for material structures apply to virtual space? Some architects view metaverse work as pure speculation or entertainment; others see it as the future of practice as increasing activity shifts online. For cities, virtual architecture raises complex questions about governance, property rights, and the relationship between digital and physical development. Will vibrant virtual districts reduce demand for physical space? Should planning departments regulate virtual development? As spatial computing and augmented reality advance, the boundary between physical and virtual architecture will continue blurring.",virtual_architecture.jpg
28,Sign 28,Beyond Green,Diversification of environmental values among people,We are already aware that there is no justice in environmental countermeasures,We feel that the arguments for reducing the environmental burden that focus solely on reducing carbon are coming apart at the seams.,"Due to governmental measures to reduce the cost of solar power generation and promote next generation automobiles, next generation energy sources will penetrate widely into people's everyday lives through demonstrational experiments and institutional reforms. Furthermore, consumer behavior is changing from ownership to usage through expansion of the car sharing market, etc., and people are starting to choose life styles with a lower environmental burden according to varlous senses of value such as convenlence and personal principles. This sort of sense of value will become more diverse with the coming of a new generation. People that reach the age of twenty in 2025 will be of the environment native generation, who have experlenced power conservation on a large scale during their formative years, received environmental education and are thoroughly aware of the mechanism to reduce the environmental burden. The range in the sense of values regarding the reduction of the environmental burden based on differences in knowledge, generation and regional location will become wider. Moreover, environment natives who have a high degree of literacy when it comes to environmental measures will seek justice and transparency in the usage of environmental measures. If the eco-point system has failed in calculating CO2 emission reduction, it will result in a loss of empathy for the social system.",beyond-green.jpg
29,Sign 29,Micro Eco,Improvement of eco-decomposition capability,From Eco-activities at the society level to a convincing Eco-life I can feel and be satisfied with,People are growing tired of an imposed ethical sense of values and start to seek direct motivation.,"According to an opinion poll performed by the Cabinet Office, small eco-activities that can be carried out easily by each individual such as carrying an eco-bag in order to reduce waste are gradually penetrating among the general public. In the case of eating habits, small-eco activities are also spreading, for example mineral water claiming ecological soundness as its basic concept gains high popularity or the number of people who grow food in their home garden as self production and self consumption is increasing. This trend can also be observed in energy consumption, such as in the permeation of LED lighting in general households. The Ministry of Economy, Trade and Industry is also trying to enhance the motivation of the people in the reduction of the environmental burden by visualizing energy through deployment of Smart Meters, the automated meter reader of electricity consumption in every household. From now on, the focus will shift from the former vague enlightenment type eco activities at the level of society to accessible ecological activities in our daily lives where we can actually understand, act and feel the effect.",micro-eco.jpg
30,Sign 30,"The Slower, The Smarter",The needs for both city and nature,There is not just one ideal way of living,I choose this town because I would like to enjoy urban life as well as life in the countryside.,"The number of people who experience farming as a leisure activity or people who work on their allotment gardens seriously is increasing. The trend started in England, with the title WWOOF/World Wide Opportunities on Organic Farms where accommodation and meals are provided in exchange for help with farm work has now spread to 20 countries including Japan. Moreover, there are many people whose lives are based in the countryside and want to enjoy the convenience of urban life while living in natural surroundings. With this sort of background, some municipalities in rural areas adjacent to cities have started to work on inviting people stressing the appeal of compatibility with both supporting the environment of permaculture and accessibility to the city center as an additional value. In order to pursue a comfortable life that matches the individual s sense of values, the number of families who will change their work life balance dynamically along with their stage of life will increase in the future. It is also expected that local industry will be enhanced through improvement of environment and transportation put in place to accept this new population, but not only that, expansion of peripheral markets giving rise to new needs is also expected.",the-slower-the-smarter.jpg
31,Sign 31,Ownership,From ownership to usership,Satisfaction is gained not only through delighting in material possessions,"Satisfaction is gained through owning the story behind the object, rather than from the approval of others or self satisfaction through purchasing products.","Throughout the world consumer activities are changing from ""ownership to usage"". The movement toward reducing the environmental burden has added a sense of social responsibility to purchasing activity that used to be carried out simply under one's own responsibility, and regulations covering appropriate disposal methods have become an obstacle to ownership. On the other hand, because of the increased avallability of opportunities to use a car without owning one through car sharing schemes such as Zipcar, etc. or using cloud computing, the choice of a ""life without ownership"" is now open to us. Moreover, expansion of freemium business is now changing the meaning of the price paid for ownership or usage. Increasingly, the consumer no longer sees a meaning in the simple fact of owning something. Experience gained through interaction with objects or services, formation of human relationships, personal principles or social significance are becoming more valued than a sense of ownership or being an owner. With regard to social assets, while it is becoming difficult for municipalities to develop a social infrastructure and there is a growing need for the creation of a social system through cooperation between the public and private sectors, the individual's sense of ownership of social assets is essential for sustainability and there is a strong need for a system that creates a sense of empathy and participation among the citizens.",ownership.jpg
