id,sign,title,summary,intro,introQuote,detail,thumbnail
1,Sign 1,Linear Megacity,Revolutionary linear urban planning that challenges traditional radial city models,"""The city stretches 170 kilometers in a straight line, 500 meters high and 200 meters wide...""","Saudi Arabia's The Line project proposes a fundamentally different approach to urban development, creating a vertical community structure that eliminates the need for cars and reduces urban sprawl.","The Line represents a radical reimagining of urban form, moving away from the traditional center-outward expansion model. This linear city concept spans 170 kilometers with a height of 500 meters and width of 200 meters, creating vertically distributed communities. The design prioritizes walkability, with all essential services accessible within a 5-minute walk. The city aims to house 9 million residents while maintaining zero carbon emissions through renewable energy integration. This model challenges conventional thinking about urban density, transportation, and the relationship between nature and built environment. The project raises important questions about scalability, social dynamics in vertical communities, and the feasibility of such ambitious infrastructure projects.",line_city.jpg
2,Sign 2,Planetary Regeneration,Long-term vision for global regeneration leading to safer climate conditions,"""A few hundred years from now, global regeneration might bring us a safer climate...""","Planet City is a provocative prototype responding to climate crisis, exploring how humanity could reorganize to minimize environmental impact while maximizing rewilding opportunities.","Planet City is a conceptual urban model designed as a response to climate change challenges. Rather than sprawling development, it proposes concentrating the entire human population into a single hyper-dense city, allowing the rest of the planet to regenerate naturally. This radical proposition serves as a thought experiment about trade-offs between human habitation and ecological restoration. The model explores how extreme urban density combined with advanced technology could support human life while dedicating vast areas to carbon sequestration, biodiversity recovery, and natural ecosystem restoration. While intentionally provocative and unrealistic as a literal blueprint, it challenges us to rethink the relationship between urbanization and planetary health, questioning whether our current distributed settlement patterns are sustainable in the long term.",planet_city.jpg
3,Sign 3,Emotional Architecture,Combating architectural indifference through emotionally engaging urban design,"""Buildings make us feel indifferent...""","Designer Thomas Heatherwick criticizes the characterless architecture dominating new urban developments, calling for spaces that evoke emotional responses and human connection.","British designer Thomas Heatherwick has become a vocal critic of what he calls ""characterless architecture"" - the bland, generic buildings that increasingly define modern cities worldwide. At Singapore Design Week, he argued that contemporary urban development prioritizes efficiency and cost over human emotional needs, resulting in environments that make people feel indifferent or even depressed. His critique extends beyond aesthetics to question fundamental assumptions about urban design: Why do we accept buildings that lack personality? How does architectural monotony affect mental health and community cohesion? Heatherwick advocates for architecture that tells stories, creates memorable experiences, and fosters genuine human connection. This perspective challenges the architecture and development industries to reconsider their priorities, placing human emotional wellbeing at the center of urban design decisions rather than treating it as a secondary concern.",emotional_arch.jpg
4,Sign 4,Civic Price,Commoditization of cities,"Because you can see the value, you will one day encounter a city that really suits you","When it becomes possible to quantitatively compare and evaluate, the current way of life will suddenly seem to lose its color.","As the scale of the economy withers more seriously due to the aging of the population and population decrease, it will become difficult to maintain infrastructure facilities in cities. Municipalities are required to make an independent effort to present their attractions in a manner that facilitates comparison with other cities for the purpose of attracting people and industries in order to survive. Against this background, international organizations including the United Nations presented a universal method for measuring the CO2 emissions of each city and actually calculated the emissions of major cities around the world, so various ""indexes to evaluate the urban environment"" have started to appear. These indexes will be used effectively to indicate the characteristics of urban development to associated bodies in the development of special zones. Reduction in the environmental burden will not be the only factor in regenerating a city or establishing a new city. One important factor that might make one city stand out in comparison with others for potential residents may be the extent to which it is equipped with functionality that supports a more diverse set of values, which includes basic performance factors such as safety, security and convenience, participation of aged people in the community, consideration of the work life balance such as proximity of the work place and home and an understanding of diversity.",civic-price.jpg
5,Sign 5,Fluid Workspaces,Redefining office environments to support employee wellbeing and productivity,"""When many are reevaluating how offices impact employee happiness and productivity...""",Architects LeeAnn Suen and Florian Idenburg are reimagining workplace design to prioritize human needs over corporate efficiency.,"The pandemic fundamentally disrupted traditional office paradigms, forcing a wholesale reevaluation of why, when, and how people work in physical spaces. Architects and designers like LeeAnn Suen and Florian Idenburg are leading efforts to reimagine workplaces not as productivity machines but as environments supporting holistic human wellbeing. This shift involves multiple dimensions: spatial flexibility that accommodates diverse work styles and tasks; biophilic design integrating nature; social spaces fostering collaboration and community; quiet zones for focused work; and technology supporting rather than dominating the environment. The emerging model treats offices as amenities that enhance remote work rather than replacing it, offering experiences impossible at home. This transformation has profound implications for urban design, as demand shifts from conventional office towers to mixed-use developments integrating work, life, and play. It also challenges organizations to articulate clear value propositions for physical presence beyond mere monitoring and control.",fluid_workspace.jpg
6,Sign 6,Industrial Heritage Reactivation,Transforming abandoned quarries and industrial sites into vibrant urban spaces,"""Exploring the possibility of site-specific spatial transformation for various stone quarries...""","Each quarry has its unique history and current state, leading design teams to create customized adaptive reuse strategies.","As cities mature, they inherit extensive portfolios of abandoned industrial sites - quarries, factories, warehouses, rail yards - that present both challenges and opportunities. These sites often occupy valuable urban land but carry environmental contamination, structural complications, and community trauma. Progressive cities are pioneering adaptive reuse strategies that honor industrial heritage while creating new public value. The approach requires deep understanding of each site's unique characteristics: topography, materials, history, and community context. Successful transformations go beyond simple preservation, reimagining these spaces as parks, cultural venues, innovation districts, or mixed-use developments that serve contemporary needs while maintaining historical continuity. This trend reflects growing appreciation for industrial aesthetics, desire for authentic urban experiences, and practical need to accommodate growth within existing city footprints rather than through sprawl. It also represents environmental stewardship, as adaptive reuse typically has lower carbon impact than new construction.",quarry_transform.jpg
7,Sign 7,Green Retail Evolution,Retail spaces transformed into interactive sustainability experiences,"""KFC launches 'Little Green Store' creating green interactive experience spaces...""","Hangzhou's Little Green Store features rooftop solar panels generating 10,000 kWh of clean electricity annually for restaurant use.","The retail sector faces existential pressure from e-commerce, climate concerns, and changing consumer values. Forward-thinking companies are responding by transforming physical stores from transactional spaces into experiential sustainability showcases. KFC's ""Little Green Store"" concept exemplifies this evolution, integrating solar power generation, IoT-based energy management, and educational components that make sustainability visible and engaging. The store functions as both business location and community resource, demonstrating how commercial spaces can contribute to urban environmental goals while maintaining profitability. This model challenges the retail industry to rethink its role: rather than merely selling products, stores become platforms for education, community gathering, and demonstrating sustainable practices. The trend extends beyond individual businesses to influence urban planning, as cities consider how to incentivize or require retail developments to contribute to sustainability goals. It also reflects evolving consumer expectations, particularly among younger generations who increasingly demand that brands align with environmental values through action rather than just marketing.",green_retail.jpg
8,Sign 8,Ecological Infrastructure,Building wildlife crossings and green corridors within urban transportation networks,"""They're building a 'sky bridge' for wildlife over busy highways...""","The passage design is deliberately 'wild' - planted with thick vegetation to appear as part of the mountain, attracting animals to use it safely.","Urban expansion and transportation infrastructure have fragmented natural habitats, threatening biodiversity and increasing human-wildlife conflicts. Ecological infrastructure represents a paradigm shift that integrates wildlife needs into urban and transportation planning from the outset. Wildlife crossings - bridges or tunnels designed specifically for animals - are becoming standard components of highway projects in progressive jurisdictions. These structures do more than prevent roadkill; they maintain genetic diversity by enabling animal movement between isolated populations, support ecosystem health, and reflect growing societal recognition that cities exist within rather than apart from nature. The design of these crossings requires sophisticated understanding of animal behavior, with features like vegetation cover, appropriate dimensions, and strategic placement based on migration patterns. This approach challenges traditional infrastructure planning that optimized purely for human movement efficiency and cost. As climate change forces species migration and cities expand into previously wild areas, ecological infrastructure will become increasingly critical for maintaining biodiversity and ecosystem services that ultimately support human wellbeing.",wildlife_crossing.jpg
9,Sign 9,Retrofit Revolution,Accelerating building decarbonization through innovative facade systems,"""From old houses to 'eco-friendly homes' - just add a new 'skin'...""","At current speeds, it would take 500 years to complete low-carbon transformation of all European buildings. A German company wants to create a 'fast track'.","Buildings account for nearly 40% of global carbon emissions, with most coming from existing structures that will remain standing for decades. Traditional renovation approaches are too slow and expensive to meet climate targets. Innovative companies like Germany's Ecoworks are pioneering industrialized retrofit systems that dramatically accelerate and reduce costs of building decarbonization. Their approach treats renovation like manufacturing: precisely measuring existing buildings, prefabricating customized facade panels off-site with integrated insulation and systems, then rapidly installing them with minimal disruption to occupants. This ""new skin"" approach can reduce building energy consumption by 70-80% while improving comfort and aesthetics. The model addresses a critical bottleneck in urban sustainability: the existing building stock. It also creates new industries and jobs while preserving housing affordability - crucial as cities balance climate goals with social equity. The trend represents a broader shift toward treating buildings as upgradable systems rather than static structures, enabling cities to meet sustainability targets without wholesale demolition and reconstruction.",building_retrofit.jpg
10,Sign 10,Acoustic Sanctuaries,Creating quiet zones and noise reduction systems in dense urban environments,"""She designed 'noise-canceling headphones' for houses...""","Facing constant outdoor noise, Kristina Loginova previously could only close windows to reduce sound, but she discovered a better solution.","Urban noise pollution affects billions of people worldwide, contributing to stress, sleep disruption, cardiovascular disease, and reduced quality of life. Traditional approaches focus on source reduction or barriers, but designer Kristina Loginova developed a novel solution: adaptive acoustic panels that function like active noise cancellation for buildings. Her system uses microphones to detect external noise patterns, then generates counter-frequencies through external speakers, creating quiet zones without completely sealing off natural ventilation and connection to the outdoors. This innovation represents a growing field of acoustic design that treats sound as a designable element of urban environments rather than an unavoidable nuisance. The trend extends beyond individual buildings to urban planning strategies that create ""quiet zones"" - parks, pedestrian areas, and residential districts protected from traffic noise through spatial planning, vegetation, and surface treatments. As cities densify and mental health concerns grow, acoustic quality is increasingly recognized as essential infrastructure alongside water, energy, and communications. This shift challenges developers, architects, and city planners to consider sound environments as carefully as visual aesthetics or functional efficiency.",acoustic_design.jpg
11,Sign 11,Vehicle-to-Grid Cities,Electric vehicles as distributed urban energy storage and supply systems,"""This Dutch city wants to turn electric vehicles into the city's 'mobile power source'...""",Robin Berg explains the project that combines two major trends: renewable energy proliferation and electric vehicle adoption.,"The convergence of electric vehicle adoption and renewable energy expansion creates unprecedented opportunities for urban energy management. The Dutch ""We Drive Solar"" project pioneered vehicle-to-grid (V2G) systems that treat EV batteries as distributed energy storage, absorbing excess solar and wind power when available, then feeding electricity back to the grid during peak demand or renewable generation gaps. This bidirectional flow transforms vehicles from pure consumers to active participants in urban energy systems, enhancing grid stability while providing economic benefits to vehicle owners. The model requires coordinated planning across transportation, energy, and urban design sectors - exactly the kind of systems integration that cities increasingly need. It also shifts the economics of EV ownership, as vehicles generate revenue through grid services, and urban planning, as parking infrastructure becomes energy infrastructure. The trend accelerates the transition to renewable energy by solving the intermittency challenge without massive stationary battery installations. It represents a broader pattern in smart cities: leveraging distributed resources and digital coordination to create resilient, efficient systems from assets that already exist for other purposes.",v2g_city.jpg
12,Sign 12,Alternative Water Sources,Extracting water from unexpected urban and agricultural sources,"""Tomatoes and grapes have become new 'water sources'...""","An Australian company is bringing a different kind of 'water source' to California: ""Simply put, we 'grow' water.""","Water scarcity affects growing numbers of cities globally, driven by climate change, population growth, and aquifer depletion. Traditional responses focus on conservation and efficiency, but innovative companies are exploring radical alternatives. Australian firm Botanical Water Technologies developed processes to extract water from agricultural waste - specifically tomatoes and grapes that don't meet cosmetic standards for sale. Their system extracts pure water from produce that would otherwise be discarded, creating a new water source while reducing food waste. This approach exemplifies broader trends toward circular economy thinking in urban resource management: treating waste as feedstock, creating closed-loop systems, and finding value in materials previously considered worthless. It challenges conventional water infrastructure planning that assumes supply must come from rivers, reservoirs, or desalination. As climate change makes traditional sources less reliable, cities are exploring diverse alternatives including atmospheric water generation, wastewater reuse, and now agricultural byproducts. These innovations don't replace conventional sources but create more resilient systems through diversification. They also highlight interconnections between food, water, and urban systems that planning has historically treated separately.",alt_water.jpg
13,Sign 13,Intergenerational Fusion,Mixed-age communities designed to support interaction across generations,"""Kampung Admiralty is Singapore's first cross-generational mixed-use complex...""","The project integrates senior housing, childcare, medical facilities, and public spaces in a single vertical community.","Demographic trends present cities with dual challenges: aging populations requiring expanded care infrastructure, and social fragmentation that isolates both elderly and young. Intergenerational housing represents an integrated response, designing communities specifically to facilitate interaction and mutual support across age groups. Singapore's Kampung Admiralty pioneered this approach at scale, vertically stacking senior housing, childcare facilities, medical services, retail, and community spaces within a single complex. The design creates natural intersection points where different generations encounter each other daily, building relationships that benefit all. Elderly residents gain purpose through mentoring relationships with children, combating isolation and depression. Young families access affordable childcare and eldercare in close proximity. The community becomes more resilient as residents support each other informally. This model challenges age-segregated development patterns that have dominated recent decades, treating different life stages as requiring separation rather than integration. It also addresses urban land scarcity by efficiently combining functions in vertical mixed-use structures. As populations age globally and nuclear families become less common, intergenerational design offers a path toward more supportive, sustainable urban communities.",intergenerational.jpg
14,Sign 14,Metaverse Marketplaces,Virtual second-hand markets creating new social and commercial spaces,"""Around is a metaverse second-hand market providing delightful pre-owned shopping experiences...""",Designer Jeong-in Lee envisions it as a new social space that transcends traditional markets.,"The metaverse is evolving beyond gaming and entertainment into commercial and social infrastructure. Designer Jeong-in Lee's ""Around"" project reimagines second-hand commerce in virtual space, creating immersive experiences that make sustainable shopping engaging and social. Unlike conventional e-commerce platforms that reduce shopping to transactional interfaces, metaverse marketplaces offer spatial exploration, serendipitous discovery, and social interaction similar to physical markets but without geographic constraints. This model addresses multiple urban challenges: reducing material consumption and waste through circular economy enablement; creating community spaces accessible to people with mobility constraints; and demonstrating economic models for metaverse environments beyond speculation and gaming. It also represents generational shifts in how people socialize and shop, with younger cohorts comfortable mixing digital and physical experiences. For cities, metaverse development raises new questions about governance, economics, and the relationship between virtual and physical space. Will vibrant virtual markets reduce demand for physical retail space? How do cities capture economic value from digital activity? As the boundary between physical and digital urban life blurs, planners must develop frameworks addressing both realms.",metaverse_market.jpg
15,Sign 15,Renewable Street Furniture,Public infrastructure that generates its own power through integrated renewables,"""Carbon neutrality, new energy public facilities, light pollution control...""",Designer Tobias Trübenbacher developed the Papilio streetlight with integrated wind turbines that generate power through wind energy.,"Cities contain vast quantities of public infrastructure - streetlights, bus shelters, signage, traffic signals - that collectively consume enormous energy while occupying valuable urban space. Forward-thinking designers are reimagining these elements as distributed renewable energy generators and smart city nodes. The Papilio streetlight exemplifies this approach, integrating small wind turbines that generate power for illumination, eliminating grid dependence while creating distinctive urban landmarks. Similar innovations include solar-powered bus shelters with integrated information displays, kinetic pavement generating power from footsteps, and smart benches with charging stations powered by integrated photovoltaics. This trend represents a shift from viewing public infrastructure as pure cost and maintenance burden to seeing it as opportunity for energy generation, data collection, and urban amenity provision. It also addresses light pollution through smarter controls that adjust brightness based on actual need. As cities pursue carbon neutrality and smart city strategies, multifunctional infrastructure that combines services, generates energy, and improves urban quality becomes increasingly attractive. The approach reduces infrastructure costs over lifecycle while contributing to sustainability goals and creating more responsive, adaptable urban environments.",renewable_street.jpg
16,Sign 16,Structural Energy Storage,Building materials that double as batteries for renewable energy storage,"""Concrete buildings transformed into large rechargeable batteries...""",Scientists at Chalmers University of Technology are developing sustainable building materials with integrated energy storage capabilities.,"Energy storage represents one of the greatest barriers to renewable energy transition, with conventional battery production carrying significant environmental costs and spatial requirements. Researchers at Chalmers University are pioneering revolutionary building materials that store electrical energy within their structure, effectively turning entire buildings into batteries. Their concrete composite incorporates carbon fiber mesh that acts as electrodes within the material itself, storing energy chemically within the building structure. This innovation could transform how cities manage renewable energy: buildings absorb excess solar and wind power when available, then release it during high-demand periods, functioning as distributed grid batteries without requiring separate storage facilities. The technology remains early-stage, with current prototypes storing modest amounts compared to conventional batteries, but the potential is enormous. A single large building could store megawatt-hours of energy, providing grid stabilization services while offsetting its own energy consumption. This represents a broader trend toward multifunctional building systems where every component serves multiple purposes - structure, energy storage, thermal management, data transmission - rather than single-function specialization. It challenges both material science and architecture to reimagine buildings as active participants in urban energy systems.",structural_battery.jpg
